<?xml version="1.0" encoding="UTF-8"?>
<config
	xmlns:xsi="http://www.w3.org/2001/XMLSchema-instance"
	xsi:noNamespaceSchemaLocation="conf.xsd">
	
	<!-- Threads -->
	<scheduler>
		<max-workers>8</max-workers>
	</scheduler>
	
	<!-- Queue -->
	<queue>
		<adapter>activemq</adapter>
		<dsn>tcp://localhost:61616</dsn>
		<queue>des-msgs</queue>
	</queue>
	
	<!-- Data -->
	<data>
		<driver>com.mysql.jdbc.Driver</driver>
		<dsn>jdbc:mysql://des:des123@localhost:3306/des</dsn>
	</data>
	
	<!-- Paths -->
	<profiles>profiles</profiles>
	
	<!-- Commands -->
	<commands>
		<!-- FFmpeg -->
		<command>
			<name>FFMpeg</name>
			<path>/tools/ffmpeg-20120416-git-4fa706a-win64-static/bin/ffmpeg.exe</path>
			<options-type>POSIX</options-type>
			<template>%1$2s -i %2$2s%3$2s %4$2s</template>
		</command>
		
		<!-- Image Magick -->
		<command>
			<name>IMagick</name>
			<path>/tools/ImageMagick-6.7.6-Q16/convert.exe</path>
			<options-type>POSIX</options-type>
			<template>%1$2s %2$2s%3$2s %4$2s</template>
		</command>
		
		<!-- F4F Packager -->
		<command>
			<name>F4FPackager</name>
			<path>/tools/adobe_f4fpackager_4_5_1_windows_x64/f4fpackager.exe</path>
			<options-type>GNU</options-type>
			<template>%1$2s --input-file=%2$2s%3$2s --output-path=%4$2s</template>
		</command>
		
		<!-- MP4 Box -->
		<command>
			<name>MP4Box</name>
			<path>/tools/MP4Box-0.4.6-rev2735/MP4Box.exe</path>
			<options-type>POSIX</options-type>
			<template>%1$2s %3$2s %2$2s</template>
		</command>
	</commands>
	
</config>